71,การแสดงโขนเรื่องรามเกียรติ์ ตอน ศึกวิรุญมุข,"ข่ายเหล็ก, ชามพูวราช, ทำพิธี, พลลิง, มังกรกัณฐ์, รับอาสา, รามเกียรติ์, วิรุญจำบัง, วิรุญมุข, ศรนาคบาศ, สมรภูมิ, หนุมาน, อาสา, เดินอากาศ, โอรส",ข่ายเหล็ก:desc_exact; ชามพูวราช:desc_exact; ทำพิธี:desc_exact; พลลิง:desc_exact; มังกรกัณฐ์:desc_exact; รับอาสา:desc_exact; รามเกียรติ์:name_exact; วิรุญจำบัง:desc_exact; วิรุญมุข:name_exact; ศรนาคบาศ:desc_exact; สมรภูมิ:desc_exact; หนุมาน:desc_exact; อาสา:desc_exact; เดินอากาศ:desc_exact; โอรส:desc_exact
72,กินนรีร่อนออกมโนราห์บูชายัญ,"กระบวนท่ารำ, กินรี, นางกินรี, บูชายัญ, มโนราห์, ละครชาตรี, สระอโนดาต, เล่นน้ำ",กระบวนท่ารำ:desc_exact; กินรี:desc_exact; นางกินรี:desc_exact; บูชายัญ:name_exact; มโนราห์:name_exact; ละครชาตรี:desc_exact; สระอโนดาต:desc_exact; เล่นน้ำ:desc_exact
73,การแสดงโขนเรื่องรามเกียรติ์ ตอน ศึกสัทธาสูร,"ขี่ม้า, ข่ายเพชร, จนตาย, บอกทาง, ฟองน้ำ, ภูเขา, รามเกียรติ์, วานร, วิรุญจำบัง, ศรพาลจันทร์, สัทธาสูร, หนุมาน, หลบหนี, อาวุธ, เขาสัตภัณฑ์",ขี่ม้า:desc_exact; ข่ายเพชร:desc_exact; จนตาย:desc_exact; บอกทาง:desc_exact; ฟองน้ำ:desc_exact; ภูเขา:desc_exact; รามเกียรติ์:name_exact; วานร:desc_exact; วิรุญจำบัง:desc_exact; ศรพาลจันทร์:desc_exact; สัทธาสูร:name_exact; หนุมาน:desc_exact; หลบหนี:desc_exact; อาวุธ:desc_exact; เขาสัตภัณฑ์:desc_exact
74,การแสดงโขนเรื่องรามเกียรติ์ ตอน ศึกพรหมาสตร์,"กราบทูล, กองทัพ, กาลสูร, ช้างเอราวัณ, ทำพิธี, นางฟ้า, พรหมาสตร์, พระอินทร์, มังกรกัณฐ์, รามเกียรติ์, รุทการ, สังหาร, สิ้นชีวิต, แปลงกาย, แปลงตัว",กราบทูล:desc_exact; กองทัพ:desc_exact; กาลสูร:desc_exact; ช้างเอราวัณ:desc_exact; ทำพิธี:desc_exact; นางฟ้า:desc_exact; พรหมาสตร์:name_exact; พระอินทร์:desc_exact; มังกรกัณฐ์:desc_exact; รามเกียรติ์:name_exact; รุทการ:desc_exact; สังหาร:desc_exact; สิ้นชีวิต:desc_exact; แปลงกาย:desc_exact; แปลงตัว:desc_exact
75,ระบำกรับ,"กรับพวง, ดนตรีพื้นบ้าน, ดนตรีไทย, ต้นขา, ทำนอง, ท่วงทำนอง, ฝ่ามือ, มือขวา, เครื่องดนตรีพื้นบ้าน, เครื่องดนตรีพื้นเมือง, เพลงไทย",กรับพวง:desc_exact; ดนตรีพื้นบ้าน:desc_exact; ดนตรีไทย:desc_exact; ต้นขา:desc_exact; ทำนอง:desc_exact; ท่วงทำนอง:desc_exact; ฝ่ามือ:desc_exact; มือขวา:desc_exact; เครื่องดนตรีพื้นบ้าน:desc_exact; เครื่องดนตรีพื้นเมือง:desc_exact; เพลงไทย:desc_exact
76,การแสดงโขนเรื่องรามเกียรติ์ ตอน สามจับ,"กลอุบาย, กุมภกรรณ, ต่อสู้, ต้นรัง, ถอยทัพ, รามเกียรติ์, สุครีพ, หนุมาน, หมดแรง, องคต, ออกอุบาย",กลอุบาย:desc_fuzzy; กุมภกรรณ:desc_exact; ต่อสู้:desc_exact; ต้นรัง:desc_exact; ถอยทัพ:desc_exact; รามเกียรติ์:name_exact; สุครีพ:desc_exact; หนุมาน:desc_fuzzy; หมดแรง:desc_exact; องคต:desc_exact; ออกอุบาย:desc_exact
77,การแสดงโขนเรื่องรามเกียรติ์ ตอน สุครีพถอนต้นรัง,"กุมภกรรณ, ต้นรัง, ถอยทัพ, ทศกัณฐ์, ทัพหน้า, พลับพลา, รามเกียรติ์, สุครีพ, หนุมาน, หมดแรง, องคต, อนุชา, ออกศึก, ออกอุบาย, เชษฐา",กุมภกรรณ:desc_exact; ต้นรัง:name_exact; ถอยทัพ:desc_exact; ทศกัณฐ์:desc_exact; ทัพหน้า:desc_exact; พลับพลา:desc_exact; รามเกียรติ์:name_exact; สุครีพ:name_exact; หนุมาน:desc_fuzzy; หมดแรง:desc_exact; องคต:desc_exact; อนุชา:desc_exact; ออกศึก:desc_exact; ออกอุบาย:desc_exact; เชษฐา:desc_exact
78,การแสดงโขนเรื่องรามเกียรติ์ ตอน พระคเณศเสียงา,"กิจจะ, ตัวพระ, ต่อสู้, นักษัตร, ปรศุราม, ปารวตี, พระคเณศ, พระตำหนัก, พระนารายณ์, พระศิวะ, พระองค์, รามเกียรติ์, อาวุธ, เขาไกรลาส, เข้าเฝ้า",กิจจะ:desc_exact; ตัวพระ:desc_exact; ต่อสู้:desc_exact; นักษัตร:desc_exact; ปรศุราม:desc_exact; ปารวตี:desc_exact; พระคเณศ:name_exact; พระตำหนัก:desc_exact; พระนารายณ์:desc_exact; พระศิวะ:desc_exact; พระองค์:desc_exact; รามเกียรติ์:name_exact; อาวุธ:desc_exact; เขาไกรลาส:desc_exact; เข้าเฝ้า:desc_exact
79,ระบำฉิ่ง,"ดนตรีพื้นบ้าน, ดนตรีไทย, ทำนอง, ท่วงทำนอง, รัวฉิ่ง, เครื่องดนตรีพื้นบ้าน, เครื่องดนตรีพื้นเมือง, เพลงไทย",ดนตรีพื้นบ้าน:desc_exact; ดนตรีไทย:desc_exact; ทำนอง:desc_exact; ท่วงทำนอง:desc_exact; รัวฉิ่ง:desc_exact; เครื่องดนตรีพื้นบ้าน:desc_exact; เครื่องดนตรีพื้นเมือง:desc_exact; เพลงไทย:desc_exact
80,ระบำเทพบันเทิง,"ระบำมาตรฐาน, รำมาตรฐาน, ละครใน, องค์ปะตาระกาหลา, อิเหนา, เทพธิดา, เทพบุตร, แต่งกายยืนเครื่องพระ",ระบำมาตรฐาน:desc_exact; รำมาตรฐาน:desc_fuzzy; ละครใน:desc_exact; องค์ปะตาระกาหลา:desc_exact; อิเหนา:desc_exact; เทพธิดา:desc_exact; เทพบุตร:desc_exact; แต่งกายยืนเครื่องพระ:desc_exact
81,การแสดงโขนเรื่องรามเกียรติ์ ตอน ขับพิเภก,"กรุงลงกา, กลายร่าง, การศึก, จุดไฟ, ติดมือ, ทำนาย, น้ำมันยาง, ปราชัย, พิเภก, รับใช้, รามเกียรติ์, สะเดาะ, สำมนักขา, ไฟไหม้, ไส้กะลา",กรุงลงกา:desc_exact; กลายร่าง:desc_exact; การศึก:desc_exact; จุดไฟ:desc_exact; ติดมือ:desc_exact; ทำนาย:desc_exact; น้ำมันยาง:desc_exact; ปราชัย:desc_exact; พิเภก:name_exact; รับใช้:desc_exact; รามเกียรติ์:name_exact; สะเดาะ:desc_exact; สำมนักขา:desc_exact; ไฟไหม้:desc_exact; ไส้กะลา:desc_exact
82,ระบำพรหมาสตร์,"กองทัพ, การุณราช, ช้างเอราวัณ, ทศกัณฐ์, นางฟ้า, พรหมาสตร์, พระลักษมณ์, พระอินทร์, รามเกียรติ์, วานร, อินทรชิต, เทวดา, แปลงกาย, แปลงตัว, โอรส",กองทัพ:desc_exact; การุณราช:desc_exact; ช้างเอราวัณ:desc_exact; ทศกัณฐ์:desc_exact; นางฟ้า:desc_exact; พรหมาสตร์:name_exact; พระลักษมณ์:desc_exact; พระอินทร์:desc_exact; รามเกียรติ์:desc_exact; วานร:desc_exact; อินทรชิต:desc_exact; เทวดา:desc_exact; แปลงกาย:desc_exact; แปลงตัว:desc_exact; โอรส:desc_exact
83,รจนาเสี่ยงพวงมาลัย,"นางเอก, บทละคร, บุปเพสันนิวาส, พระสังข์, พระเอก, พวงมาลัย, รจนา, รูปทอง, รูปนอก, สวามี, สังข์ทอง, เจ้าหญิง, เจ้าเงาะ, แกล้งทำ, แปลงตัว",นางเอก:desc_exact; บทละคร:desc_exact; บุปเพสันนิวาส:desc_exact; พระสังข์:desc_exact; พระเอก:desc_exact; พวงมาลัย:name_exact; รจนา:name_exact; รูปทอง:desc_exact; รูปนอก:desc_exact; สวามี:desc_exact; สังข์ทอง:desc_exact; เจ้าหญิง:desc_exact; เจ้าเงาะ:desc_exact; แกล้งทำ:desc_exact; แปลงตัว:desc_exact
84,ระบำชุดไทยพระราชนิยม,"ฉลองพระองค์, ดนตรีไทย, บทร้อง, พระบรมราชชนนีพันปีหลวง, พระราม, พระองค์, ยมะ, ไทยจักรพรรดิ์, ไทยจักรี, ไทยจิตรลดา, ไทยดุสิต, ไทยบรมพิมาน, ไทยศิวาลัย, ไทยอมรินทร์, ไทยเรือนต้น",ฉลองพระองค์:desc_exact; ดนตรีไทย:desc_fuzzy; บทร้อง:desc_exact; พระบรมราชชนนีพันปีหลวง:desc_exact; พระราม:name_fuzzy; พระองค์:desc_exact; ยมะ:name_fuzzy; ไทยจักรพรรดิ์:desc_exact; ไทยจักรี:desc_exact; ไทยจิตรลดา:desc_exact; ไทยดุสิต:desc_exact; ไทยบรมพิมาน:desc_exact; ไทยศิวาลัย:desc_exact; ไทยอมรินทร์:desc_exact; ไทยเรือนต้น:desc_exact
85,ระบำกินรีร่อน,"กินรี, ทำนอง, ท่วงทำนอง, สระอโนดาต, เขาไกรลาส, เพลงไทย, เล่นน้ำ",กินรี:name_exact; ทำนอง:desc_exact; ท่วงทำนอง:desc_exact; สระอโนดาต:desc_exact; เขาไกรลาส:desc_exact; เพลงไทย:desc_exact; เล่นน้ำ:desc_fuzzy
86,ระบำกฤดาภินิหาร,"กรมศิลปากร, การทอ, การรบ, การสอน, นางฟ้า, บทร้อง, ยมะ, ศุภลักษณ์, สากล, เกียรติศักดิ์ไทย, เทวดา",กรมศิลปากร:desc_exact; การทอ:desc_fuzzy; การรบ:desc_fuzzy; การสอน:desc_exact; นางฟ้า:desc_exact; บทร้อง:desc_exact; ยมะ:desc_exact; ศุภลักษณ์:desc_exact; สากล:desc_exact; เกียรติศักดิ์ไทย:desc_exact; เทวดา:desc_exact
87,รำซัดชาตรี,"การรบ, ดนตรีพื้นบ้าน, ดนตรีไทย, ตารี, ทำนอง, ท่วงทำนอง, ผู้แสดงฝ่ายชาย, ผู้แสดงฝ่ายหญิง, รำคู่, รำพัด, ละครชาตรี, ละครใน, เบิกโรง, ไหว้ครู",การรบ:desc_fuzzy; ดนตรีพื้นบ้าน:desc_exact; ดนตรีไทย:desc_exact; ตารี:name_fuzzy; ทำนอง:desc_exact; ท่วงทำนอง:desc_exact; ผู้แสดงฝ่ายชาย:desc_exact; ผู้แสดงฝ่ายหญิง:desc_exact; รำคู่:desc_exact; รำพัด:desc_fuzzy; ละครชาตรี:desc_exact; ละครใน:desc_fuzzy; เบิกโรง:desc_exact; ไหว้ครู:desc_exact
88,ระบำวิชนี,"คำร้อง, ทำนอง, ทำนองเพลง, นางใน, บทร้อง, มือขวา, ราชสำนัก, วิชนี, หญิงสาว, เพลงไทย",คำร้อง:desc_fuzzy; ทำนอง:desc_exact; ทำนองเพลง:desc_exact; นางใน:desc_exact; บทร้อง:desc_exact; มือขวา:desc_exact; ราชสำนัก:desc_exact; วิชนี:name_exact; หญิงสาว:desc_exact; เพลงไทย:desc_exact
89,เมขลา รามสูร,"จับนาง, ดวงแก้ว, ตำนาน, ทะเล, นางฟ้า, รามสูร, ฤดูฝน, วสันตฤดู, อสูร, เดินทาง, เทพธิดา, เทพนิยาย, เทพบุตร, เทวดา, เมขลา",จับนาง:desc_fuzzy; ดวงแก้ว:desc_exact; ตำนาน:desc_exact; ทะเล:desc_exact; นางฟ้า:desc_exact; รามสูร:name_exact; ฤดูฝน:desc_exact; วสันตฤดู:desc_exact; อสูร:name_fuzzy; เดินทาง:desc_exact; เทพธิดา:desc_exact; เทพนิยาย:desc_exact; เทพบุตร:desc_exact; เทวดา:desc_exact; เมขลา:name_exact
90,ระบำย่องหงิด,"กระบวนท่ารำ, คำร้อง, จับระบำ, ทำนอง, ทำนองเพลง, นางฟ้า, พี่เลี้ยง, ย่องหงิด, ละครใน, ศุภลักษณ์, อาสา, อุษา, เทพธิดา, เทวดา, เพลงไทย",กระบวนท่ารำ:desc_exact; คำร้อง:desc_exact; จับระบำ:desc_exact; ทำนอง:desc_exact; ทำนองเพลง:desc_exact; นางฟ้า:desc_exact; พี่เลี้ยง:desc_exact; ย่องหงิด:name_exact; ละครใน:desc_exact; ศุภลักษณ์:desc_exact; อาสา:desc_exact; อุษา:desc_exact; เทพธิดา:desc_exact; เทวดา:desc_exact; เพลงไทย:desc_exact
91,ระบำดาวดึงส์,"จับระบำ, ดาวดึงส์, ทิพยวิมาน, บรรพต, พระลอ, พระอินทร์, ระบำมาตรฐาน, รำมาตรฐาน, ละครดึกดำบรรพ์, สังข์ทอง, เทพธิดา, เทพบุตร, แต่งกายยืนเครื่องพระ",จับระบำ:desc_exact; ดาวดึงส์:name_exact; ทิพยวิมาน:desc_exact; บรรพต:desc_fuzzy; พระลอ:desc_fuzzy; พระอินทร์:desc_exact; ระบำมาตรฐาน:desc_exact; รำมาตรฐาน:desc_fuzzy; ละครดึกดำบรรพ์:desc_exact; สังข์ทอง:desc_exact; เทพธิดา:desc_exact; เทพบุตร:desc_exact; แต่งกายยืนเครื่องพระ:desc_exact
92,ระบำศรีชยสิงห์,"กาญจนบุรี, จารึก, นางอัปสราบายน, บุรี, ปราสาทพระขรรค์, ปราสาทเมืองสิงห์, พระเจ้าชัยวรมัน, ภาพจำหลัก, ริมแม่น้ำ, เครื่องแบบ, แควน้อย, แม่น้ำ",กาญจนบุรี:desc_exact; จารึก:desc_exact; นางอัปสราบายน:desc_exact; บุรี:desc_exact; ปราสาทพระขรรค์:desc_exact; ปราสาทเมืองสิงห์:desc_exact; พระเจ้าชัยวรมัน:desc_exact; ภาพจำหลัก:desc_exact; ริมแม่น้ำ:desc_exact; เครื่องแบบ:desc_fuzzy; แควน้อย:desc_exact; แม่น้ำ:desc_exact
93,รำแม่บท,"กระบวนท่ารำ, บทร้อง, ระบำมาตรฐาน, รำมาตรฐาน, ล้านนา, แต่งกายยืนเครื่องพระ, แม่บท",กระบวนท่ารำ:desc_exact; บทร้อง:desc_exact; ระบำมาตรฐาน:desc_fuzzy; รำมาตรฐาน:desc_exact; ล้านนา:desc_fuzzy; แต่งกายยืนเครื่องพระ:desc_exact; แม่บท:name_exact
94,รำฝรั่งคู่,"การรบ, จีนรัว, จีนรำพัด, ตะเขิ่ง, ทำนอง, ทำนองเพลง, รำคู่, รำพัด, เจ้าเซ็น, เพลงฉิ่ง, เพลงฝรั่งรำเท้า, เพลงเร็ว, เพลงไทย, แต่งกายยืนเครื่องพระ",การรบ:desc_fuzzy; จีนรัว:desc_exact; จีนรำพัด:desc_exact; ตะเขิ่ง:desc_exact; ทำนอง:desc_exact; ทำนองเพลง:desc_fuzzy; รำคู่:desc_exact; รำพัด:desc_exact; เจ้าเซ็น:desc_exact; เพลงฉิ่ง:desc_exact; เพลงฝรั่งรำเท้า:desc_exact; เพลงเร็ว:desc_exact; เพลงไทย:desc_exact; แต่งกายยืนเครื่องพระ:desc_exact
95,รำประเลง,"ทำนอง, ทำนองเพลง, ปิดหน้า, รังควาญ, ละครใน, หางนกยูง, อิทธิฤทธิ์, เทวดา, เบิกโรง, เพลงกลม, เพลงชำนาญ, เพลงหน้าพาทย์, เพลงไทย, เสนียดจัญไร, โคมเวียน",ทำนอง:desc_exact; ทำนองเพลง:desc_exact; ปิดหน้า:desc_exact; รังควาญ:desc_exact; ละครใน:desc_exact; หางนกยูง:desc_exact; อิทธิฤทธิ์:desc_exact; เทวดา:desc_exact; เบิกโรง:desc_exact; เพลงกลม:desc_exact; เพลงชำนาญ:desc_exact; เพลงหน้าพาทย์:desc_exact; เพลงไทย:name_fuzzy; เสนียดจัญไร:desc_exact; โคมเวียน:desc_exact
96,รำเบิกโรงดอกไม้เงินทอง,"ดอกไม้, ดอกไม้เงิน, ทำนอง, ทำนองเพลง, บทร้อง, พระบาทสมเด็จพระจอมเกล้าเจ้าอยู่หัว, พระบาทสมเด็จพระจุลจอมเกล้าเจ้าอยู่หัว, พระลอ, มือขวา, มือซ้าย, ละครใน, วันทอง, เบิกโรง, เพลงไทย, แต่งกายยืนเครื่องพระ",ดอกไม้:name_exact; ดอกไม้เงิน:name_exact; ทำนอง:desc_exact; ทำนองเพลง:desc_exact; บทร้อง:desc_exact; พระบาทสมเด็จพระจอมเกล้าเจ้าอยู่หัว:desc_exact; พระบาทสมเด็จพระจุลจอมเกล้าเจ้าอยู่หัว:desc_fuzzy; พระลอ:desc_fuzzy; มือขวา:desc_exact; มือซ้าย:desc_exact; ละครใน:desc_exact; วันทอง:name_fuzzy; เบิกโรง:name_exact; เพลงไทย:desc_exact; แต่งกายยืนเครื่องพระ:desc_exact
97,หนุมานจับนางสุพรรณมัจฉา,"กระบวนท่ารำ, กรุงลงกา, การเกี้ยวพาราสี, การไถ, จับนาง, นางสีดา, บริวาร, พระราม, มหาสมุทร, รามเกียรติ์, วานร, สุพรรณมัจฉา, หนุมาน, ออกเดินทาง, เดินทาง",กระบวนท่ารำ:desc_fuzzy; กรุงลงกา:desc_exact; การเกี้ยวพาราสี:desc_exact; การไถ:desc_fuzzy; จับนาง:name_exact; นางสีดา:desc_exact; บริวาร:desc_exact; พระราม:desc_fuzzy; มหาสมุทร:desc_exact; รามเกียรติ์:desc_exact; วานร:desc_exact; สุพรรณมัจฉา:name_exact; หนุมาน:name_exact; ออกเดินทาง:desc_fuzzy; เดินทาง:desc_exact
98,หนุมานจับนางเบญกาย,"การเกี้ยวพาราสี, การไถ, จับนาง, ทศกัณฐ์, นางสีดา, พระยา, พระราม, ยักษิณี, รามเกียรติ์, ลอยน้ำ, วานร, หนุมาน, หลบหนี, หายตัว, เบญกาย",การเกี้ยวพาราสี:desc_fuzzy; การไถ:desc_fuzzy; จับนาง:name_exact; ทศกัณฐ์:desc_exact; นางสีดา:desc_exact; พระยา:desc_fuzzy; พระราม:desc_exact; ยักษิณี:desc_exact; รามเกียรติ์:desc_exact; ลอยน้ำ:desc_exact; วานร:desc_exact; หนุมาน:name_exact; หลบหนี:desc_exact; หายตัว:desc_fuzzy; เบญกาย:name_exact
99,ระบำนพรัตน์,"ทับทิม, บุษราคัม, มรกต, อัญมณี, เพทาย, โกเมน, ไพฑูรย์",ทับทิม:desc_exact; บุษราคัม:desc_exact; มรกต:desc_exact; อัญมณี:desc_exact; เพทาย:desc_exact; โกเมน:desc_exact; ไพฑูรย์:desc_exact
100,รำพลายชุมพล,"ขุนช้าง, ขุนแผน, ทำนอง, ทำนองเพลง, พระไวย, พลายชุมพล, รำเดี่ยว, ละครเสภา, วาจา, ออกรบ, เพลงมอญดูดาว, เพลงไทย, แก้แค้น, แตกทัพ, แต่งตัว",ขุนช้าง:desc_exact; ขุนแผน:desc_exact; ทำนอง:desc_exact; ทำนองเพลง:desc_exact; พระไวย:desc_exact; พลายชุมพล:name_exact; รำเดี่ยว:desc_exact; ละครเสภา:desc_exact; วาจา:desc_exact; ออกรบ:desc_exact; เพลงมอญดูดาว:desc_exact; เพลงไทย:desc_exact; แก้แค้น:desc_exact; แตกทัพ:desc_exact; แต่งตัว:desc_exact
